{
  "canonical_inputs": [
    "generated/skills/skill-registry.json",
    "generated/skills/command-registry.json",
    "generated/skills/scenario-packs.json"
  ],
  "edges": [
    {
      "from": "scenario:canonical-recovery-runbook",
      "kind": "runs",
      "to": "command:docs-catalog-governance"
    },
    {
      "from": "scenario:canonical-recovery-runbook",
      "kind": "runs",
      "to": "command:docs-policy-gate"
    },
    {
      "from": "scenario:canonical-recovery-runbook",
      "kind": "requires",
      "to": "skill:docs-truth-review"
    },
    {
      "from": "scenario:canonical-recovery-runbook",
      "kind": "requires",
      "to": "skill:runbook-evidence-triage"
    },
    {
      "from": "scenario:canonical-topology-lookup",
      "kind": "runs",
      "to": "command:platform-plan-validate"
    },
    {
      "from": "scenario:canonical-topology-lookup",
      "kind": "runs",
      "to": "command:promote-help"
    },
    {
      "from": "scenario:canonical-topology-lookup",
      "kind": "requires",
      "to": "skill:service-identity-lookup"
    },
    {
      "from": "scenario:canonical-topology-lookup",
      "kind": "requires",
      "to": "skill:topology-lookup"
    },
    {
      "from": "scenario:cross-repo-diff-impact",
      "kind": "runs",
      "to": "command:docs-policy-gate"
    },
    {
      "from": "scenario:cross-repo-diff-impact",
      "kind": "runs",
      "to": "command:docs-world-class-gates"
    },
    {
      "from": "scenario:cross-repo-diff-impact",
      "kind": "runs",
      "to": "command:platform-plan-validate"
    },
    {
      "from": "scenario:cross-repo-diff-impact",
      "kind": "requires",
      "to": "skill:change-impact-triage"
    },
    {
      "from": "scenario:cross-repo-diff-impact",
      "kind": "requires",
      "to": "skill:control-plane-validation"
    },
    {
      "from": "scenario:promote-app-safely",
      "kind": "runs",
      "to": "command:docs-world-class-gates"
    },
    {
      "from": "scenario:promote-app-safely",
      "kind": "runs",
      "to": "command:platform-plan-validate"
    },
    {
      "from": "scenario:promote-app-safely",
      "kind": "runs",
      "to": "command:promote-dry-run"
    },
    {
      "from": "scenario:promote-app-safely",
      "kind": "runs",
      "to": "command:promote-help"
    },
    {
      "from": "scenario:promote-app-safely",
      "kind": "requires",
      "to": "skill:cross-repo-release-contract-review"
    },
    {
      "from": "scenario:promote-app-safely",
      "kind": "requires",
      "to": "skill:promotion-workflow-review"
    },
    {
      "from": "scenario:promote-app-safely",
      "kind": "requires",
      "to": "skill:release-obligations-review"
    },
    {
      "from": "scenario:repo-ownership-of-truth",
      "kind": "runs",
      "to": "command:docs-policy-gate"
    },
    {
      "from": "scenario:repo-ownership-of-truth",
      "kind": "runs",
      "to": "command:platform-plan-validate"
    },
    {
      "from": "scenario:repo-ownership-of-truth",
      "kind": "runs",
      "to": "command:promote-help"
    },
    {
      "from": "scenario:repo-ownership-of-truth",
      "kind": "requires",
      "to": "skill:change-impact-triage"
    },
    {
      "from": "scenario:repo-ownership-of-truth",
      "kind": "requires",
      "to": "skill:service-identity-lookup"
    },
    {
      "from": "scenario:repo-ownership-of-truth",
      "kind": "requires",
      "to": "skill:topology-lookup"
    },
    {
      "from": "scenario:required-reviewers-for-diff",
      "kind": "runs",
      "to": "command:docs-catalog-governance"
    },
    {
      "from": "scenario:required-reviewers-for-diff",
      "kind": "runs",
      "to": "command:docs-policy-gate"
    },
    {
      "from": "scenario:required-reviewers-for-diff",
      "kind": "runs",
      "to": "command:docs-world-class-gates"
    },
    {
      "from": "scenario:required-reviewers-for-diff",
      "kind": "runs",
      "to": "command:platform-plan-validate"
    },
    {
      "from": "scenario:required-reviewers-for-diff",
      "kind": "requires",
      "to": "skill:change-impact-triage"
    },
    {
      "from": "scenario:required-reviewers-for-diff",
      "kind": "requires",
      "to": "skill:control-plane-validation"
    },
    {
      "from": "scenario:required-reviewers-for-diff",
      "kind": "requires",
      "to": "skill:docs-truth-review"
    },
    {
      "from": "scenario:service-alias-change-impact",
      "kind": "runs",
      "to": "command:docs-policy-gate"
    },
    {
      "from": "scenario:service-alias-change-impact",
      "kind": "runs",
      "to": "command:docs-world-class-gates"
    },
    {
      "from": "scenario:service-alias-change-impact",
      "kind": "runs",
      "to": "command:platform-plan-validate"
    },
    {
      "from": "scenario:service-alias-change-impact",
      "kind": "requires",
      "to": "skill:change-impact-triage"
    },
    {
      "from": "scenario:service-alias-change-impact",
      "kind": "requires",
      "to": "skill:cross-repo-release-contract-review"
    },
    {
      "from": "scenario:service-alias-change-impact",
      "kind": "requires",
      "to": "skill:service-identity-lookup"
    },
    {
      "from": "scenario:wrapper-retirement",
      "kind": "runs",
      "to": "command:docs-catalog-governance"
    },
    {
      "from": "scenario:wrapper-retirement",
      "kind": "runs",
      "to": "command:docs-policy-gate"
    },
    {
      "from": "scenario:wrapper-retirement",
      "kind": "runs",
      "to": "command:wrapper-residue-scan"
    },
    {
      "from": "scenario:wrapper-retirement",
      "kind": "requires",
      "to": "skill:docs-truth-review"
    },
    {
      "from": "scenario:wrapper-retirement",
      "kind": "requires",
      "to": "skill:wrapper-retirement-assessment"
    },
    {
      "from": "skill:change-impact-triage",
      "kind": "runs",
      "to": "command:docs-policy-gate"
    },
    {
      "from": "skill:change-impact-triage",
      "kind": "runs",
      "to": "command:platform-plan-validate"
    },
    {
      "from": "skill:change-impact-triage",
      "kind": "reads",
      "to": "source:bbi-infrastructure:config/bootstrap-lane-topology.yaml"
    },
    {
      "from": "skill:change-impact-triage",
      "kind": "reads",
      "to": "source:mereka-lms:docs/concepts/architecture/DOCUMENTATION_AUTHORITY_RESOLVER.md"
    },
    {
      "from": "skill:change-impact-triage",
      "kind": "reads",
      "to": "source:platform-control-plane:contracts/release-contracts.yaml"
    },
    {
      "from": "skill:control-plane-validation",
      "kind": "runs",
      "to": "command:docs-world-class-gates"
    },
    {
      "from": "skill:control-plane-validation",
      "kind": "runs",
      "to": "command:platform-plan-validate"
    },
    {
      "from": "skill:control-plane-validation",
      "kind": "reads",
      "to": "source:bbi-infrastructure:scripts/promote.sh"
    },
    {
      "from": "skill:control-plane-validation",
      "kind": "reads",
      "to": "source:mereka-lms:tools/docs/verify/run-docs-world-class-gates.sh"
    },
    {
      "from": "skill:control-plane-validation",
      "kind": "reads",
      "to": "source:platform-control-plane:scripts/plan-all.sh"
    },
    {
      "from": "skill:cross-repo-release-contract-review",
      "kind": "runs",
      "to": "command:docs-world-class-gates"
    },
    {
      "from": "skill:cross-repo-release-contract-review",
      "kind": "runs",
      "to": "command:platform-plan-validate"
    },
    {
      "from": "skill:cross-repo-release-contract-review",
      "kind": "reads",
      "to": "source:bbi-infrastructure:.github/workflows/promote-image.yml"
    },
    {
      "from": "skill:cross-repo-release-contract-review",
      "kind": "reads",
      "to": "source:mereka-lms:docs/meta/standing-orders/GOVERNANCE_AGENT.md"
    },
    {
      "from": "skill:cross-repo-release-contract-review",
      "kind": "reads",
      "to": "source:platform-control-plane:contracts/release-contracts.yaml"
    },
    {
      "from": "skill:cross-repo-release-contract-review",
      "kind": "reads",
      "to": "source:platform-control-plane:contracts/service-identity-contract.yaml"
    },
    {
      "from": "skill:docs-truth-review",
      "kind": "runs",
      "to": "command:docs-catalog-governance"
    },
    {
      "from": "skill:docs-truth-review",
      "kind": "runs",
      "to": "command:docs-policy-gate"
    },
    {
      "from": "skill:docs-truth-review",
      "kind": "reads",
      "to": "source:mereka-lms:docs/concepts/architecture/DOCUMENTATION_AUTHORITY_RESOLVER.md"
    },
    {
      "from": "skill:docs-truth-review",
      "kind": "reads",
      "to": "source:mereka-lms:docs/meta/standing-orders/README.md"
    },
    {
      "from": "skill:docs-truth-review",
      "kind": "reads",
      "to": "source:mereka-lms:tools/docs/verify/verify-doc-catalog-governance.py"
    },
    {
      "from": "skill:docs-truth-review",
      "kind": "reads",
      "to": "source:mereka-lms:tools/docs/verify/verify-docs-policy.sh"
    },
    {
      "from": "skill:promotion-workflow-review",
      "kind": "runs",
      "to": "command:promote-dry-run"
    },
    {
      "from": "skill:promotion-workflow-review",
      "kind": "runs",
      "to": "command:promote-help"
    },
    {
      "from": "skill:promotion-workflow-review",
      "kind": "reads",
      "to": "source:bbi-infrastructure:.github/workflows/promote-image.yml"
    },
    {
      "from": "skill:promotion-workflow-review",
      "kind": "reads",
      "to": "source:bbi-infrastructure:config/domain-registry.yaml"
    },
    {
      "from": "skill:promotion-workflow-review",
      "kind": "reads",
      "to": "source:bbi-infrastructure:scripts/promote.sh"
    },
    {
      "from": "skill:promotion-workflow-review",
      "kind": "reads",